Sheet: TyC
A1: TÉRMINOS Y CONDICIONES
A2: mes: | B2: #MES# | C2: dia: | D2: #DIA# | E2: hora: | F2: #HORA# | H2: idApuesta | I2: #Idapuesta#

Sheet: EXCH normal
B4: cuotas bajas y parcidas
D6: DATOS INICIAL DE LA CASA | G6: ID APUESTA: | H6: of:=[$TyC.$I$2] -> #Idapuesta#
G7: fecha: dia | H7: of:=[$TyC.$D$2] -> #DIA# | I7: of:=RIGHT("0"& [.H7];2) -> A#
D8: of:=[.B11] -> casa | E8: BEFTAIR | G8: fecha: mes | H8: of:=[$TyC.$B$2] -> #MES# | I8: of:=RIGHT("0"& [.H8];2) -> S# | J8: of:=[.O12] -> -1 | K8: of:=[.O11] -> Id: 03 #Idapuesta# | L8: of:=[.J12] -> casa | M8: of:=CONCATENATE([.I12];[.I13];[.I14])& " "&[.I9] -> 0 vs EN CONTRA HORA: #HORA# | O8: of:=[.K11] -> fecha: A#/S# | P8: of:=SUM([.L12:.L14]) -> 1
B9: Otra casa | C9: PARDIDO/RESULTADO | D9: OTRA CASA | G9: HORA: | H9: of:=[$TyC.$F$2] -> #HORA# | I9: of:="HORA: "&[.H9] -> HORA: #HORA# | K9: Modelo Para apuesta NORMAL
D10: GASTO | E10: riego: | F10: BENEFICIO | J10: Casa | K10: Mercado | L10: Cantidad | M10: Cuota | N10: Premio | O10: Beneficio | P10: Resultado
B11: casa | I11: of:=[.H6] -> #Idapuesta# | J11: Apuesta Normal | K11: of:="fecha: " & [.I7] &"/" & [.I8] -> fecha: A#/S# | L11: of:=CONCATENATE([.I12];" ";[.I13];" ";[.I14]) -> 0  vs  EN CONTRA | M11: of:=CONCATENATE("Importe Jugado:";ROUND(SUM([.L12:.L15]);2)) -> Importe Jugado:1 | O11: of:=CONCATENATE("Id: 03 ";[.I11]) -> Id: 03 #Idapuesta#
D12: PREMIO | F12: 0.98 | G12: comision | I12: of:=[.K12] -> 0 | J12: of:=[.B11] -> casa | K12: of:=[.C11] -> 0 | L12: of:=IF([.D11]=0;1;[.D11]) -> 1 | M12: of:=[.N12]/[.L12] -> 0 | N12: of:=[.D13] -> 0 | O12: of:=MIN([.N12:.N13])-[.L12]-[.L13] -> -1
B13: cuota | D13: of:=[.C13]*[.D11] -> 0 | F13: of:=[.F11]*[.F12] -> 0 | G13: beneficio real | I13: vs | J13: BETFAIR | K13: EN CONTRA | L13: of:=[.E11] -> 0 | M13: of:=[.N13]/[.L13] ->  | N13: of:=[.E11]+[.F13] -> 0
D14: OTRA CASA | E14: BEFTAIR | I14: of:=[.K13] -> EN CONTRA | J14: coe: | K14: of:=[.O12]/[.L12] -> -1
C16: SI ganas en BETFAIR | F16: of:=[.J12] -> casa | G16: betfair
D17: se juega | E17: inicial | F17: of:=[.D7] -> 0 | G17: of:=[.E7] -> 0 | H17: of:=[.G17]+[.F17] -> 0
D18: of:=[.I7] -> A# | E18: echa | F18: of:=[.F17]-[.D11] -> 0 | G18: of:=[.G17]-[.E11] -> 0
E19: FINAL | F19: of:=[.F18] -> 0 | G19: of:=[.G17]+[.F13] -> 0 | H19: of:=[.G19]+[.F19] -> 0
H20: of:=[.H19]-[.H17] -> 0 | I20: 'BENEFICIO
G21: ¿BETFREE ASOCIADA SI PIERDO? TIPO REEMBOLSO | H21: 0
H22: of:=[.H21]+[.H20] -> 0 | I22: BENEFICIO FINAL
C25: of:="SI ganas " & [.D8] -> SI ganas casa | F25: of:=[.F16] -> casa | G25: betfair
D26: se juega | E26: inicial | F26: of:=[.D7] -> 0 | G26: of:=[.E7] -> 0 | H26: of:=[.G26]+[.F26] -> 0
D27: of:=[.I7] -> A# | E27: echa | F27: of:=[.F18] -> 0 | G27: of:=[.G18] -> 0
E28: FINAL | F28: of:=[.F27]+[.D13] -> 0 | G28: of:=[.G27] -> 0 | H28: of:=[.G28]+[.F28] -> 0
G29: ¿BETFREE ASOCIADA SI GANO ? TIPO DOBLAMOS TUS GANANCIAS
H30: of:=[.H28]-[.H26]+[.H29] -> 0 | I30: 'BENEFICIO
C33: of:=[.H37] -> -0.00502512562834045 | D33: of:=[.H36] -> Id: 03 #Idapuesta# | E33: of:=[.C37] -> casa | F33: of:=CONCATENATE([.B37];[.B38];[.B39])& " "&[.B34] -> finmes vs finmes HORA: #HORA# | H33: of:=[.D36] -> fecha: A#/S# | I33: of:=SUM([.E37:.E40]) -> 2.00502512562834
B34: of:="HORA: "&[.H9] -> HORA: #HORA# | D34: Modelo Para apuesta NORMAL
C35: Casa | D35: Mercado | E35: Cantidad | F35: Cuota | G35: Premio | H35: Beneficio | I35: Resultado
B36: of:=[.H6] -> #Idapuesta# | C36: Apuesta Normal | D36: of:="fecha: " & [.I7] &"/" & [.I8] -> fecha: A#/S# | E36: of:=CONCATENATE([.B37];" ";[.B38];" ";[.B39]) -> finmes  vs  finmes | F36: of:=CONCATENATE("Importe Jugado:";ROUND(SUM([.E37:.E40]);2)) -> Importe Jugado:2,01 | H36: of:=CONCATENATE("Id: 03 ";[.B36]) -> Id: 03 #Idapuesta#
B37: of:=[.D37] -> finmes | C37: casa | D37: finmes | E37: 1 | F37: 2 | G37: of:=[.F37]*[.E37] -> 2 | H37: of:=[.G37]-SUM([.E37:.E40]) -> -0.00502512562834045
B38: vs | C38: casa | D38: finmes | E38: of:=[.G38]/[.F38] -> 1.00502512562814 | F38: 1.99 | G38: of:=[.G37] -> 2
B39: of:=[.D39] -> finmes | C39: casa | D39: finmes | E39: of:=[.G39]/[.F39] -> 0.0000000000002 | F39: 10000000000000 | G39: of:=[.G37] -> 2
C40: coe: | D40: of:=[.H37]/[.E37] -> -0.00502512562834045

Sheet: EXCH free
B1: BENEFICIO NETO | C1: 1 | E1: BENE+COMISION: | F1: of:=[.C1]/0.98 -> 1.02040816326531 | H1: APUESTA | I1: CUOTA | J1: PREMIO | L1: BENE+COM | N1: BENEFICIO NETO
B2: CUOTA ROSA: | C2: 14.5 | E2: RIESGO: | F2: of:=[.C2]*[.F1]-[.F1] -> 13.7755102040816 | H2: of:=[.F2] -> 13.7755102040816 | I2: of:=[.F3] -> 1.07407407407407 | J2: of:=[.I2]*[.H2] -> 14.7959183673469 | L2: of:=[.F1] -> 1.02040816326531 | N2: of:=[.L2]*0.98 -> 1
E3: CUOTA EQUI: | F3: of:=([.F2]+[.F1])/[.F2] -> 1.07407407407407
B6: apuesta GRATIS | D6: cuotas altas y parecidas
D8: DATOS INICIAL DE LA CASA | G8: ID APUESTA: | H8: of:=[$TyC.$I$2] -> #Idapuesta# | I8: -FREEBET
G9: fecha: dia | H9: of:=[$TyC.$D$2] -> #DIA# | I9: of:=RIGHT("0"& [.H9];2) -> A#
D10: OTRA CASA | E10: BEFTAIR | G10: fecha: mes | H10: of:=[$TyC.$B$2] -> #MES# | I10: of:=RIGHT("0"& [.H10];2) -> S# | J10: of:=[.O14] -> 0 | K10: of:=[.O13] -> Id: 03 #Idapuesta#-FREEBET | L10: of:=[.J14] -> casa | M10: of:=CONCATENATE([.I14];[.I15];[.I16])& " "&[.I11] -> 0 vs EN CONTRA HORA: #HORA# | O10: of:=[.K13] -> fecha: A#/S# | P10: of:=SUM([.L15]) -> 0
B11: Otra casa | C11: PARDIDO/RESULTADO | G11: HORA: | H11: of:=[$TyC.$F$2] -> #HORA# | I11: of:="HORA: "&[.H11] -> HORA: #HORA# | K11: Modelo Para apuesta NORMAL
D12: FREEBET | E12: riego: | F12: BENEFICIO | J12: Casa | K12: Mercado | L12: Cantidad | M12: Cuota | N12: Premio | O12: Beneficio | P12: Resultado
B13: casa | I13: of:=[.H8]&[.I8] -> #Idapuesta#-FREEBET | J13: Apuesta Normal | K13: of:="fecha: " & [.I9] &"/" & [.I10] -> fecha: A#/S# | L13: of:=CONCATENATE([.I14];" ";[.I15];" ";[.I16]) -> 0  vs  EN CONTRA | M13: of:=CONCATENATE("Importe Jugado:";ROUND(SUM([.L14:.L17]);2)) -> Importe Jugado:1 | O13: of:=CONCATENATE("Id: 03 ";[.I13]) -> Id: 03 #Idapuesta#-FREEBET
B14: CUOTA APUESTA GRATIS: | D14: PREMIO | F14: 0.98 | G14: comision | I14: of:=[.K14] -> 0 | J14: of:=[.B13] -> casa | K14: of:=[.C13] -> 0 | L14: of:=IF([.D13]=0;1;[.D13]) -> 1 | M14: of:=[.C15] -> 0 | N14: of:=[.D15] -> 0 | O14: of:=MIN([.N14:.N15])-[.L15] -> 0
D15: of:=[.C15]*[.D13]-[.D13] -> 0 | F15: of:=[.F13]*[.F14] -> 0 | G15: beneficio real | I15: vs | J15: BETFAIR | K15: EN CONTRA | L15: of:=[.E13] -> 0 | M15: of:=[.N15]/[.L15] ->  | N15: of:=[.F15]+[.E13] -> 0
D16: OTRA CASA | E16: BEFTAIR | I16: of:=[.K15] -> EN CONTRA | J16: coe: | K16: of:=[.O14]/[.L14] -> 0
C20: SI ganas en BETFAIR | F20: of:=[.J14] -> casa | G20: betfair
D21: se juega | E21: inicial | F21: of:=[.D9] -> 0 | G21: of:=[.E9] -> 0 | H21: of:=[.G21]+[.F21] -> 0
D22: of:=[.H9] -> #DIA# | E22: echa | F22: of:=[.F21] -> 0 | G22: of:=[.G21]-[.E13] -> 0
E23: FINAL | F23: of:=[.F22] -> 0 | G23: of:=[.G21]+[.F15] -> 0 | H23: of:=[.G23]+[.F23] -> 0
H24: of:=[.H23]-[.H21] -> 0 | I24: 'BENEFICIO
C27: of:="SI ganas " & [.B13] -> SI ganas casa | F27: of:=[.F20] -> casa | G27: betfair
D28: of:=[.H9] -> #DIA# | E28: inicial | F28: of:=[.D9] -> 0 | G28: of:=[.E9] -> 0 | H28: of:=[.G28]+[.F28] -> 0
D29: of:=[.D22] -> #DIA# | E29: echa | F29: of:=[.F22] -> 0 | G29: of:=[.G22] -> 0
E30: FINAL | F30: of:=[.F29]+[.D15] -> 0 | G30: of:=[.G29] -> 0 | H30: of:=[.G30]+[.F30] -> 0
H31: of:=[.H30]-[.H28] -> 0 | I31: 'BENEFICIO
C36: of:=[.H40] -> 0.4999997 | D36: of:=[.H39] -> Id: 03 #Idapuesta#-FREEBET | E36: of:=[.C40] -> casa | F36: of:=CONCATENATE([.B40];[.B41];[.B42])& " "&[.B37] -> 0 vs 0 HORA: #HORA# | H36: of:=[.D39] -> fecha: A#/S# | I36: of:=SUM([.E41:.E43]) -> 2.5000003
B37: of:="HORA: "&[.H11] -> HORA: #HORA# | D37: Modelo Para apuesta gratis FREEBET
C38: Apuesta Casa | D38: Mercado | E38: Cantidad | F38: Cuota | G38: Premio | H38: Beneficio | I38: Resultado
B39: of:=[.H8]&[.I8] -> #Idapuesta#-FREEBET | C39: apuesta freebet | D39: of:="fecha: " & [.I9] &"/" & [.I10] -> fecha: A#/S# | E39: of:=CONCATENATE([.B40];" ";[.B41];" ";[.B42]) -> 0  vs  0 | F39: of:=CONCATENATE("Importe Jugado:";ROUND(SUM([.E41:.E44]);2)) -> Importe Jugado:2,5 | H39: of:=CONCATENATE("Id: 03 ";[.B39]) -> Id: 03 #Idapuesta#-FREEBET
B40: of:=[.D40] -> 0 | C40: casa | E40: 1 | F40: 4 | G40: of:=[.F40]*[.E40]-[.E40] -> 3 | H40: of:=[.G40]-SUM([.E41:.E44]) -> 0.4999997
B41: vs | C41: casa | E41: of:=[.G41]/[.F41] -> 0.0000003 | F41: 10000000 | G41: of:=[.G40] -> 3
B42: of:=[.D42] -> 0 | C42: casa | E42: of:=[.G42]/[.F42] -> 2.5 | F42: 1.2 | G42: of:=[.G40] -> 3
C43: coe: | D43: of:=[.H40]/[.E40] -> 0.4999997
G44: Resultado de la Promocion:
D45: AJUSTE CUOTA POR IMPORTE: | E45: 25 | F45: of:=[.G45]/[.E45] -> 1.2 | G45: 30

Sheet: Normal
B6: ID APUESTA: | C6: of:=[$TyC.$I$2] -> #Idapuesta# | E6: of:=[.J10] -> -0.00502512562834045 | F6: of:=[.J9] -> Id: 03 #Idapuesta# | G6: of:=[.E10] -> casa | H6: of:=CONCATENATE([.D10];[.D11];[.D12])& " "&[.D7] -> mercado vs mercado h.#HORA# | J6: of:=[.F9] -> fecha: A#/#MES# | K6: of:=SUM([.G10:.G13]) -> 2.00502512562834
B7: fecha: dia | C7: of:=[$TyC.$D$2] -> #DIA# | D7: of:="h."&[.C9] -> h.#HORA# | F7: Modelo Para apuesta NORMAL
B8: fecha: mes | C8: of:=[$TyC.$B$2] -> #MES# | E8: Casa | F8: Mercado | G8: Cantidad | H8: Cuota | I8: Premio | J8: Beneficio | K8: Resultado
B9: HORA: | C9: of:=[$TyC.$F$2] -> #HORA# | D9: of:=[.C6] -> #Idapuesta# | E9: Apuesta Normal | F9: of:="fecha: "& RIGHT("0"&[.C7];2) & "/" &[.C8] -> fecha: A#/#MES# | G9: of:=CONCATENATE([.D10];" ";[.D11];" ";[.D12]) -> mercado  vs  mercado | H9: of:=CONCATENATE("Importe Jugado:";ROUND(SUM([.G10:.G13]);2)) -> Importe Jugado:2,01 | J9: of:=CONCATENATE("Id: 03 ";[.D9]) -> Id: 03 #Idapuesta#
D10: of:=[.F10] -> mercado | E10: casa | F10: mercado | G10: 1 | H10: 2 | I10: of:=[.H10]*[.G10] -> 2 | J10: of:=[.I10]-SUM([.G10:.G13]) -> -0.00502512562834045
D11: vs | E11: casa | F11: mercado | G11: of:=[.I11]/[.H11] -> 1.00502512562814 | H11: 1.99 | I11: of:=[.I10] -> 2
D12: of:=[.F12] -> mercado | E12: casa | F12: mercado | G12: of:=[.I12]/[.H12] -> 0.0000000000002 | H12: 10000000000000 | I12: of:=[.I10] -> 2
E13: coe: | F13: of:=[.J10]/[.G10] -> -0.00502512562834045
B16: ID APUESTA: | C16: of:=[$TyC.$I$2] -> #Idapuesta# | E16: of:=[.J20] -> -0.00502512562814061 | F16: of:=[.J19] -> Id: 03 #Idapuesta# | G16: of:=[.E20] -> casa | H16: of:=CONCATENATE([.D20];[.D21];[.D22])& " "&[.D17] -> mercado vs mercado h.#HORA# | J16: of:=[.F19] -> fecha: A#/#MES# | K16: of:=SUM([.G20:.G23]) -> 2.00502512562814
B17: fecha: dia | C17: of:=[$TyC.$D$2] -> #DIA# | D17: of:="h."&[.C19] -> h.#HORA# | F17: Modelo Para apuesta NORMAL
B18: fecha: mes | C18: of:=[$TyC.$B$2] -> #MES# | E18: Casa | F18: Mercado | G18: Cantidad | H18: Cuota | I18: Premio | J18: Beneficio | K18: Resultado
B19: HORA: | C19: of:=[$TyC.$F$2] -> #HORA# | D19: of:=[.C16] -> #Idapuesta# | E19: Apuesta Normal | F19: of:="fecha: "& RIGHT("0"&[.C17];2) & "/" &[.C18] -> fecha: A#/#MES# | G19: of:=CONCATENATE([.D20];" ";[.D21];" ";[.D22]) -> mercado  vs  mercado | H19: of:=CONCATENATE("Importe Jugado:";ROUND(SUM([.G20:.G23]);2)) -> Importe Jugado:2,01 | J19: of:=CONCATENATE("Id: 03 ";[.D19]) -> Id: 03 #Idapuesta#
D20: of:=[.F20] -> mercado | E20: casa | F20: mercado | G20: 1 | H20: 2 | I20: of:=[.H20]*[.G20] -> 2 | J20: of:=[.I20]-SUM([.G20:.G23]) -> -0.00502512562814061
D21: vs | E21: casa | F21: mercado | G21: of:=[.I21]/[.H21] -> 1.00502512562814 | H21: 1.99 | I21: of:=[.I20] -> 2
D22: of:=[.F21] -> mercado
E23: coe: | F23: of:=[.J20]/[.G20] -> -0.00502512562814061

Sheet: Freebet
B6: ID APUESTA: | C6: of:=[$TyC.$I$2] -> #Idapuesta# | E6: of:=[.J10] -> 0.4999997 | F6: of:=[.J9] -> Id: 03 #Idapuesta#-FreeBet | G6: of:=[.E10] -> casa | H6: of:=CONCATENATE([.D10];[.D11];[.D12])& " "&[.D7] -> mercado vs mercado h.#HORA# | J6: of:=[.F9] -> fecha: A#/#MES# | K6: of:=SUM([.G11:.G13]) -> 2.5000003
B7: fecha: dia | C7: of:=[$TyC.$D$2] -> #DIA# | D7: of:="h."&[.C9] -> h.#HORA# | F7: Modelo Para apuesta gratis FREEBET
B8: fecha: mes | C8: of:=[$TyC.$B$2] -> #MES# | E8: Apuesta Casa | F8: Mercado | G8: Cantidad | H8: Cuota | I8: Premio | J8: Beneficio | K8: Resultado
B9: HORA: | C9: of:=[$TyC.$F$2] -> #HORA# | D9: of:=[.C6]&"-FreeBet" -> #Idapuesta#-FreeBet | E9: apuesta freebet | F9: of:="fecha: "& RIGHT("0"&[.C7];2) & "/" &[.C8] -> fecha: A#/#MES# | G9: of:=CONCATENATE([.D10];" ";[.D11];" ";[.D12]) -> mercado  vs  mercado | H9: of:=CONCATENATE("Importe Jugado:";ROUND(SUM([.G11:.G14]);2)) -> Importe Jugado:2,5 | J9: of:=CONCATENATE("Id: 03 ";[.D9]) -> Id: 03 #Idapuesta#-FreeBet
D10: of:=[.F10] -> mercado | E10: casa | F10: mercado | G10: 1 | H10: 4 | I10: of:=[.H10]*[.G10]-[.G10] -> 3 | J10: of:=[.I10]-SUM([.G11:.G14]) -> 0.4999997
D11: vs | E11: casa | F11: mercado | G11: of:=[.I11]/[.H11] -> 0.0000003 | H11: 10000000 | I11: of:=[.I10] -> 3
D12: of:=[.F12] -> mercado | E12: casa | F12: mercado | G12: of:=[.I12]/[.H12] -> 2.5 | H12: 1.2 | I12: of:=[.I10] -> 3
E13: coe: | F13: of:=[.J10]/[.G10] -> 0.4999997
I14: Resultado de la Promocion:
F15: AJUSTE CUOTA POR IMPORTE: | G15: 25 | H15: of:=[.I15]/[.G15] -> 1.2 | I15: 30
B17: ID APUESTA: | C17: of:=[$TyC.$I$2] -> #Idapuesta# | E17: of:=[.J21] -> 2.9999997 | F17: of:=[.J20] -> Id: 03 #Idapuesta#-FreeBet | G17: of:=[.E21] -> casa | H17: of:=CONCATENATE([.D21];[.D22];[.D23])& " "&[.D18] -> mercado vs mercado h.#HORA# | J17: of:=[.F20] -> fecha: A#/#MES# | K17: of:=SUM([.G22:.G24]) -> 0.0000003
B18: fecha: dia | C18: of:=[$TyC.$D$2] -> #DIA# | D18: of:="h."&[.C20] -> h.#HORA# | F18: Modelo Para apuesta gratis FREEBET
B19: fecha: mes | C19: of:=[$TyC.$B$2] -> #MES# | E19: Apuesta Casa | F19: Mercado | G19: Cantidad | H19: Cuota | I19: Premio | J19: Beneficio | K19: Resultado
B20: HORA: | C20: of:=[$TyC.$F$2] -> #HORA# | D20: of:=[.C17]&"-FreeBet" -> #Idapuesta#-FreeBet | E20: apuesta freebet | F20: of:="fecha: "& RIGHT("0"&[.C18];2) & "/" &[.C19] -> fecha: A#/#MES# | G20: of:=CONCATENATE([.D21];" ";[.D22];" ";[.D23]) -> mercado  vs  mercado | H20: of:=CONCATENATE("Importe Jugado:";ROUND(SUM([.G22:.G25]);2)) -> Importe Jugado:0 | J20: of:=CONCATENATE("Id: 03 ";[.D20]) -> Id: 03 #Idapuesta#-FreeBet
D21: of:=[.F21] -> mercado | E21: casa | F21: mercado | G21: 1 | H21: 4 | I21: of:=[.H21]*[.G21]-[.G21] -> 3 | J21: of:=[.I21]-SUM([.G22:.G25]) -> 2.9999997
D22: vs | E22: casa | F22: mercado | G22: of:=[.I22]/[.H22] -> 0.0000003 | H22: 10000000 | I22: of:=[.I21] -> 3
D23: of:=[.F22] -> mercado
E24: coe: | F24: of:=[.J21]/[.G21] -> 2.9999997
I25: Resultado de la Promocion:
F26: AJUSTE CUOTA POR IMPORTE: | G26: 25 | H26: of:=[.I26]/[.G26] -> 1.2 | I26: 30

Sheet: Tabla de Goles
A2: Tabla de goles para CODERE, n.º de goles marcado por el R. Madird
D3: x0,70
A4: BENERFICIO | C4: GOLES | D4: FREEBET | E4: CLASIFICATORIA | F4: MENOS 2,5 | G4: MENOS 1,5 | H4: MENOS 0,5 | K4: CELDAS A CAMBIAR
A5: of:=SUM([.D5:.I5]) -> 1.52258205244824 | C5: 0 | D5: of:=[.C5]*5*0.7 -> 0 | E5: -2.87 | F5: of:=[.F6] -> 0.499828575617176 | G5: of:=[.G6] -> 1.32608690929116 | H5: of:=[.J34] -> 2.5666665675399 | K5: 0.933333297287237 | L5: MENOS 1
A6: of:=SUM([.D6:.I6]) -> 1.5225821876211 | C6: 1 | D6: of:=[.C6]*5*0.7 -> 3.5 | E6: of:=[.E5] -> -2.87 | F6: of:=[.F7] -> 0.499828575617176 | G6: of:=[.J25] -> 1.32608690929116 | H6: of:=[.H7] -> -0.933333297287237 | K6: 2.17391296605108 | L6: MENOS 2
A7: of:=SUM([.D7:.I7]) -> 1.52258231227886 | C7: 2 | D7: of:=[.C7]*5*0.7 -> 7 | E7: of:=[.E6] -> -2.87 | F7: of:=[.J16] -> 0.499828575617176 | G7: of:=[.G8] -> -2.17391296605108 | H7: of:=[.H8] -> -0.933333297287237 | K7: 3.00017152231198 | L7: MENOS 3
A8: of:=SUM([.D8:.I8]) -> 1.5225822143497 | C8: 3 | D8: of:=[.C8]*5*0.7 -> 10.5 | E8: of:=[.E7] -> -2.87 | F8: of:=-[.G16] -> -3.00017152231198 | G8: of:=-[.G25] -> -2.17391296605108 | H8: of:=-[.G34] -> -0.933333297287237
A9: of:=AVERAGE([.A5:.A8]) -> 1.52258219167447 | D9: of:=STDEV([.A5:.A8]) -> 0.00000010717580364104 | E9: ← a minimizar | G9: -> SOLVER
B10: id apuesta: | C10: of:=[$TyC.I2] -> #Idapuesta#
B12: ID APUESTA: | C12: of:=[.C10]&"-MENOS3" -> #Idapuesta#-MENOS3 | E12: of:=[.J16] -> 0.499828575617176 | F12: of:=[.J15] -> Id: 03 #Idapuesta#-MENOS3 | G12: of:=[.E16] -> BET365 | H12: of:=CONCATENATE([.D16];[.D17];[.D18])& " "&[.D13] -> MENOS 3 vs mercado h.#HORA# | J12: of:=[.F15] -> fecha: A#/#MES# | K12: of:=SUM([.G16:.G18]) -> 3.00017152231198
B13: fecha: dia | C13: of:=[$TyC.$D$2] -> #DIA# | D13: of:="h."&[.C15] -> h.#HORA# | F13: Modelo Para apuesta NORMAL
B14: fecha: mes | C14: of:=[$TyC.$B$2] -> #MES# | E14: Casa | F14: Mercado | G14: Cantidad | H14: Cuota | I14: Premio | J14: Beneficio | K14: Resultado
B15: HORA: | C15: of:=[$TyC.$F$2] -> #HORA# | D15: of:=[.C12] -> #Idapuesta#-MENOS3 | E15: Apuesta Normal | F15: of:="fecha: "& RIGHT("0"&[.C13];2) & "/" &[.C14] -> fecha: A#/#MES# | G15: of:=CONCATENATE([.D16];" ";[.D17];" ";[.D18]) -> MENOS 3  vs  mercado | H15: of:=CONCATENATE("Importe Jugado:";ROUND(SUM([.G16:.G19]);2)) -> Importe Jugado:3 | J15: of:=CONCATENATE("Id: 03 ";[.D15]) -> Id: 03 #Idapuesta#-MENOS3
D16: of:=[.F16] -> MENOS 3 | E16: BET365 | F16: MENOS 3 | G16: of:=[.K7] -> 3.00017152231198 | H16: 1.1666 | I16: of:=[.H16]*[.G16] -> 3.50000009792916 | J16: of:=[.I16]-SUM([.G16:.G19]) -> 0.499828575617176
D17: vs | E17: BET365 | F17: mercado | H17: 1.99 | I17: 0
D18: of:=[.F17] -> mercado
E19: coe: | F19: of:=[.J16]/[.G16] -> 0.1666
B21: ID APUESTA: | C21: of:=[.C10]&"-MENOS2" -> #Idapuesta#-MENOS2 | E21: of:=[.J25] -> 1.32608690929116 | F21: of:=[.J24] -> Id: 03 #Idapuesta#-MENOS2 | G21: of:=[.E25] -> BET365 | H21: of:=CONCATENATE([.D25];[.D26];[.D27])& " "&[.D22] -> MENOS 2 vs 0 h.#HORA# | J21: of:=[.F24] -> fecha: A#/#MES# | K21: of:=SUM([.G25:.G27]) -> 2.17391296605108
B22: fecha: dia | C22: of:=[.C13] -> #DIA# | D22: of:="h."&[.C24] -> h.#HORA# | F22: Modelo Para apuesta NORMAL
B23: fecha: mes | C23: of:=[.C14] -> #MES# | E23: Casa | F23: Mercado | G23: Cantidad | H23: Cuota | I23: Premio | J23: Beneficio | K23: Resultado
B24: HORA: | C24: of:=[.C15] -> #HORA# | D24: of:=[.C21] -> #Idapuesta#-MENOS2 | E24: Apuesta Normal | F24: of:="fecha: "& RIGHT("0"&[.C22];2) & "/" &[.C23] -> fecha: A#/#MES# | G24: of:=CONCATENATE([.D25];" ";[.D26];" ";[.D27]) -> MENOS 2  vs  0 | H24: of:=CONCATENATE("Importe Jugado:";ROUND(SUM([.G25:.G28]);2)) -> Importe Jugado:2,17 | J24: of:=CONCATENATE("Id: 03 ";[.D24]) -> Id: 03 #Idapuesta#-MENOS2
D25: of:=[.F25] -> MENOS 2 | E25: BET365 | F25: MENOS 2 | G25: of:=[.K6] -> 2.17391296605108 | H25: 1.61 | I25: of:=[.H25]*[.G25] -> 3.49999987534224 | J25: of:=[.I25]-SUM([.G25:.G28]) -> 1.32608690929116
D26: vs | E26: BET365 | F26: mercado | H26: 1.99 | I26: 0
D27: of:=[.F27] -> 0
E28: coe: | F28: of:=[.J25]/[.G25] -> 0.61
B30: ID APUESTA: | C30: of:=[.C10]&"-MENOS1" -> #Idapuesta#-MENOS1 | E30: of:=[.J34] -> 2.5666665675399 | F30: of:=[.J33] -> Id: 03 #Idapuesta#-MENOS1 | G30: of:=[.E34] -> BET365 | H30: of:=CONCATENATE([.D34];[.D35];[.D36])& " "&[.D31] -> MENOS 1 vs 0 h.#HORA# | J30: of:=[.F33] -> fecha: A#/#MES# | K30: of:=SUM([.G34:.G36]) -> 0.933333297287237
B31: fecha: dia | C31: of:=[.C22] -> #DIA# | D31: of:="h."&[.C33] -> h.#HORA# | F31: Modelo Para apuesta NORMAL
B32: fecha: mes | C32: of:=[.C23] -> #MES# | E32: Casa | F32: Mercado | G32: Cantidad | H32: Cuota | I32: Premio | J32: Beneficio | K32: Resultado
B33: HORA: | C33: of:=[.C24] -> #HORA# | D33: of:=[.C30] -> #Idapuesta#-MENOS1 | E33: Apuesta Normal | F33: of:="fecha: "& RIGHT("0"&[.C31];2) & "/" &[.C32] -> fecha: A#/#MES# | G33: of:=CONCATENATE([.D34];" ";[.D35];" ";[.D36]) -> MENOS 1  vs  0 | H33: of:=CONCATENATE("Importe Jugado:";ROUND(SUM([.G34:.G37]);2)) -> Importe Jugado:0,93 | J33: of:=CONCATENATE("Id: 03 ";[.D33]) -> Id: 03 #Idapuesta#-MENOS1
D34: of:=[.F34] -> MENOS 1 | E34: BET365 | F34: MENOS 1 | G34: of:=[.K5] -> 0.933333297287237 | H34: 3.75 | I34: of:=[.H34]*[.G34] -> 3.49999986482714 | J34: of:=[.I34]-SUM([.G34:.G37]) -> 2.5666665675399
D35: vs | E35: BET365 | F35: mercado | H35: 1.99 | I35: 0
D36: of:=[.F36] -> 0
E37: coe: | F37: of:=[.J34]/[.G34] -> 2.75

Sheet: SI GANAS FREEBET
D2: Si GANAS te dan freebet
B6: ID APUESTA: | C6: of:=[$TyC.$I$2] -> #Idapuesta# | E6: of:=[.J10] -> -1.76381909547794 | F6: of:=[.J9] -> Id: 03 #Idapuesta# | G6: of:=[.E10] -> casa | H6: of:=CONCATENATE([.D10];[.D11];[.D12])& " "&[.D7] -> mercado vs mercado h.#HORA# | J6: of:=[.F9] -> fecha: A#/#MES# | K6: of:=SUM([.G10:.G13]) -> 3.76381909547794
B7: fecha: dia | C7: of:=[$TyC.$D$2] -> #DIA# | D7: of:="h."&[.C9] -> h.#HORA# | F7: Modelo Para apuesta NORMAL
B8: fecha: mes | C8: of:=[$TyC.$B$2] -> #MES# | E8: Casa | F8: Mercado | G8: Cantidad | H8: Cuota | I8: Premio | J8: Beneficio | K8: Resultado
B9: HORA: | C9: of:=[$TyC.$F$2] -> #HORA# | D9: of:=[.C6] -> #Idapuesta# | E9: Apuesta Normal | F9: of:="fecha: "& RIGHT("0"&[.C7];2) & "/" &[.C8] -> fecha: A#/#MES# | G9: of:=CONCATENATE([.D10];" ";[.D11];" ";[.D12]) -> mercado  vs  mercado | H9: of:=CONCATENATE("Importe Jugado:";ROUND(SUM([.G10:.G13]);2)) -> Importe Jugado:3,76 | J9: of:=CONCATENATE("Id: 03 ";[.D9]) -> Id: 03 #Idapuesta# | M9: PREMIO | N9: GASTO | O9: BENEFICIO
D10: of:=[.F10] -> mercado | E10: casa | F10: mercado | G10: 1 | H10: 2 | I10: of:=[.H10]*[.G10] -> 2 | J10: of:=[.I10]-SUM([.G10:.G13]) -> -1.76381909547794 | L10: -> SI GANAS | M10: of:=[.I10] -> 2 | N10: of:=SUM([.G10:.G12]) -> 3.76381909547794 | O10: of:=[.M10]+[.M11]-[.N10] -> 1.73618090452206
D11: vs | E11: casa | F11: mercado | G11: of:=[.I11]/[.H11] -> 2.76381909547739 | H11: 1.99 | I11: of:=[.M11]+[.M10] -> 5.5 | L11: FREEBET | M11: of:=[.L12]*0.7 -> 3.5
D12: of:=[.F12] -> mercado | E12: casa | F12: mercado | G12: of:=[.I12]/[.H12] -> 0.00000000000055 | H12: 10000000000000 | I12: of:=[.M11]+[.M10] -> 5.5 | L12: 5
E13: coe: | F13: of:=[.J10]/[.G10] -> -1.76381909547794 | L13: COE: 0,7

Sheet: SI PIERDES FREEBET
D2: Si pierdes te dan freebet
B6: ID APUESTA: | C6: of:=[$TyC.$I$2] -> #Idapuesta# | E6: of:=[.J10] -> 1.75376884422126 | F6: of:=[.J9] -> Id: 03 #Idapuesta# | G6: of:=[.E10] -> casa | H6: of:=CONCATENATE([.D10];[.D11];[.D12])& " "&[.D7] -> mercado vs mercado h.#HORA# | J6: of:=[.F9] -> fecha: A#/#MES# | K6: of:=SUM([.G10:.G13]) -> 0.246231155778744
B7: fecha: dia | C7: of:=[$TyC.$D$2] -> #DIA# | D7: of:="h."&[.C9] -> h.#HORA# | F7: Modelo Para apuesta NORMAL
B8: fecha: mes | C8: of:=[$TyC.$B$2] -> #MES# | E8: Casa | F8: Mercado | G8: Cantidad | H8: Cuota | I8: Premio | J8: Beneficio | K8: Resultado
B9: HORA: | C9: of:=[$TyC.$F$2] -> #HORA# | D9: of:=[.C6] -> #Idapuesta# | E9: Apuesta Normal | F9: of:="fecha: "& RIGHT("0"&[.C7];2) & "/" &[.C8] -> fecha: A#/#MES# | G9: of:=CONCATENATE([.D10];" ";[.D11];" ";[.D12]) -> mercado  vs  mercado | H9: of:=CONCATENATE("Importe Jugado:";ROUND(SUM([.G10:.G13]);2)) -> Importe Jugado:0,25 | J9: of:=CONCATENATE("Id: 03 ";[.D9]) -> Id: 03 #Idapuesta# | M9: PREMIO | N9: GASTO | O9: BENEFICIO
D10: of:=[.F10] -> mercado | E10: casa | F10: mercado | G10: 1 | H10: 2 | I10: of:=[.H10]*[.G10] -> 2 | J10: of:=[.I10]-SUM([.G10:.G13]) -> 1.75376884422126 | L10: -> SI GANAS | M10: of:=[.I10] -> 2 | N10: of:=SUM([.G10:.G12]) -> 0.246231155778744 | O10: of:=[.M10]-[.N10] -> 1.75376884422126
D11: vs | E11: casa | F11: mercado | G11: of:=[.I11]/[.H11] -> -0.753768844221106 | H11: 1.99 | I11: of:=[.M12] -> -1.5
D12: of:=[.F12] -> mercado | E12: casa | F12: mercado | G12: of:=[.I12]/[.H12] -> -0.00000000000015 | H12: 10000000000000 | I12: of:=[.M12] -> -1.5 | L12: -> SI PIERDES | M12: of:=[.M10]-[.M13] -> -1.5
E13: coe: | F13: of:=[.J10]/[.G10] -> 1.75376884422126 | L13: FREEBET | M13: of:=[.L14]*0.7 -> 3.5
L14: 5
L15: COE: 0,7

Sheet: COMBI
G2: marca
G3: Luckia
G4: BETSTARS | I4: BETFAIR
B5: FECHA | C5: HORA | D5: ENCUENTRO | E5: RESULTADO | G5: CUOTA | I5: CUOTA
G6: 1
G7: 1
G8: 1
F9: TOTAL | G9: of:=[.G8]*[.G7]*[.G6] -> 1
B10: importe normal
B11: importe | C11: cuota | D11: total
C12: of:=[.G9] -> 1 | D12: of:=[.C12]*[.B12] -> 0
B14: importe freebet
B15: importe | C15: cuota | D15: total
C16: of:=[.G9] -> 1 | D16: of:=[.C16]*[.B16]-[.B16] -> 0 | H16: Paso 1
I17: clasificatoria
I18: vs equipo | J18: of:=[.K18]*[.L18] -> 0.98 | K18: 1 | L18: 0.98
I19: freebet
I22: Total | J22: of:=SUM([.J17:.J21]) -> 0.98

Sheet: lista de casas apuesta
A1: LISTA DE CASAS
A2: ADMIRALBET | E2: Resultado
A3: BET365 | E3: ←
A4: BETFAIR
A5: BETSTARS
A6: CGM
A7: CODERE
A8: ENRACHA
A9: GOLDENPARK
A10: JUEGGING
A11: LUCKIA
A12: MARCA
A13: MRGREEN
A14: PAF
A15: PASTON
A16: SPORTIUM
A17: VERSUS
A18: WINAMAX
A19: ZEBET
A20: 777
A21: 888
A22: EBINGO
A23: DAZNBET
A24: casa
D42: ____________________________
D43: Total:3613,72

Sheet: amb
B2: ARBITRAJE PARA DINERO REAL
B3: ARBITRAJE 3 OPCIONES
C4: WINAMAX | D4: ENRACHA | E4: EXCH (azul)
C5: SC | D5: 1X / -1,5 goles | E5: CELTA
B6: CUOTA | C6: 2.5 | D6: 3.9 | E6: 3.65
B7: COMISION (%) | C7: 0 | D7: 0 | E7: 0.02
B8: CUOTA CORR | C8: of:=[.C6]*(1-[.C7])+[.C7] -> 2.5 | D8: of:=[.D6]*(1-[.D7])+[.D7] -> 3.9 | E8: of:=[.E6]*(1-[.E7])+[.E7] -> 3.597
B9: RATING | C9: of:=[.C8] - ([.C8]/[.D8])-([.C8]/[.E8]) -> 1.16395072817091 | D9: of:=[.D8]-([.D8]/[.C8])-([.D8]/[.E8]) -> 1.25576313594662 | E9: of:=[.E8]-([.E8]/[.D8])-([.E8]/[.C8]) -> 1.23589230769231
B10: Elegir | C10: 10
B11: Optimo | C11: of:=IF([.E10]>0;[.E10]*[.E8]/[.C8];IF([.D10]>0;[.D10]*[.D8]/[.C8];[.C10])) -> 10 | D11: of:=IF([.E10]>0;[.E10]*[.E8]/[.D8];IF([.C10]>0;[.C10]*[.C8]/[.D8];[.D10])) -> 6.41025641025641 | E11: of:=IF([.C10]>0;[.C10]*[.C8]/[.E8];IF([.D10]>0;[.D10]*[.D8]/[.E8];[.E10])) -> 6.95023630803447
B12: Resultado | C12: of:=[.C11]*([.C8]-1)-[.D11]-[.E11] -> 1.63950728170912 | D12: of:=[.D11]*([.D8]-1)-[.E11]-[.C11] -> 1.63950728170912 | E12: of:=[.E11]*([.E8]-1)-[.D11]-[.C11] -> 1.63950728170912
B13: Apuesta Real | C13: 200 | D13: 67.35 | E13: 44.3
B14: Cobros | C14: of:=[.C13]*([.C8]-1) -> 300 | D14: of:=[.D13]*([.D8]-1) -> 195.315 | E14: of:=[.E13]*([.E8]-1) -> 115.0471
B15: Resultado | C15: of:=[.C13]*([.C8]-1)-[.D13]-[.E13] -> 188.35 | D15: of:=[.D13]*([.D8]-1)-[.E13]-[.C13] -> -48.985 | E15: of:=[.E13]*([.E8]-1)-[.D13]-[.C13] -> -152.3029
B16: Esta hoja de cálculo se distribuye libremente y de forma gratuita gracias a amigosdelmatchedbetting. © 2022 AMIGOSDELMATCHEDBETTING Todos los derechos reservados

Sheet: FORMULA EN CONTRA
D15: CUOTA EN CONTRA: | E15: APUESTA: | F15: RIESGO | G15: Ganancia | H15: 0.02 | K15: CUOTA EQU:
D16: 4.1 | E16: 8.5 | F16: of:=[.E16]/([.K16]-1) -> 26.35 | G16: of:=[.F16]+[.E16] -> 34.85 | H16: of:=[.G16]*0.98 -> 34.153 | K16: of:=1/([.D16]-1)+1 -> 1.32258064516129

Sheet: AumentoCuotaBet365
H1: mercado1 | I1: mercado2 | J1: mercado3
G2: casas | K2: casas
G3: cuotas otras casas | K3: cuotas otras casas
G4: RESULTADO | H4: 1 | I4: 2 | J4: 3 | L4: BETFAIR
B5: PARTIDO | D5: cuota aumentada | G5: A 3 bandas | H5: CASA | I5: CASA | J5: CASA | L5: beneficio | M5: riesgo | N5: cuotas bajas y parcidas
A6: of:=[.H1] -> mercado1 | C6: 25 | D6: of:=[.E6]/[.C6] -> 10.8748 | E6: 271.87 | G6: of:=[.I16] ->  | I6: of:=[.I3] -> 0 | J6: of:=[.J3] -> 0 | K6: of:=[.H1] -> mercado1
A7: of:=[.I1] -> mercado2 | C7: of:=[.C6] -> 25 | D7: of:=[.E7]/[.C7] -> 14.5 | E7: 362.5 | G7: of:=[.I26] ->  | H7: of:=[.H3] -> 0 | J7: of:=[.J3] -> 0 | K7: of:=[.I1] -> mercado2 | P7: DATOS INICIAL DE LA CASA | S7: ID APUESTA: | T7: of:=[$TyC.$I$2] -> #Idapuesta#
A8: of:=[.J1] -> mercado3 | C8: of:=[.C6] -> 25 | D8: of:=[.E8]/[.C8] -> 15.5 | E8: 387.5 | G8: of:=[.I37] ->  | H8: of:=[.H3] -> 0 | I8: of:=[.I3] -> 0 | K8: of:=[.J1] -> mercado3 | S8: fecha: dia | T8: of:=[$TyC.$D$2] -> #DIA# | U8: of:=RIGHT("0"& [.T8];2) -> A#
P9: of:=[.N12] -> BET365 | Q9: BEFTAIR | S9: fecha: mes | T9: of:=[$TyC.$B$2] -> #MES# | U9: of:=RIGHT("0"& [.T9];2) -> S# | V9: of:=[.AA13] -> -1 | W9: of:=[.AA12] -> Id: 03 #Idapuesta# | X9: of:=[.V13] -> BET365 | Y9: of:=CONCATENATE([.U13];[.U14];[.U15])& " "&[.U10] -> 0 vs EN CONTRA HORA: #HORA# | AA9: of:=[.W12] -> FECHA: A#/S# | AB9: of:=SUM([.X13:.X15]) -> 1
N10: Otra casa | O10: PARDIDO/RESULTADO | P10: OTRA CASA | S10: HORA: | T10: of:=[$TyC.$F$2] -> #HORA# | U10: of:="HORA: "&[.T10] -> HORA: #HORA# | W10: Modelo Para apuesta NORMAL
P11: GASTO | Q11: riego: | R11: BENEFICIO | V11: Casa | W11: Mercado | X11: Cantidad | Y11: Cuota | Z11: Premio | AA11: Beneficio | AB11: Resultado
A12: ID APUESTA: | B12: of:=[$TyC.$I$2] -> #Idapuesta# | D12: of:=[.I16] ->  | E12: of:=[.I15] -> Id: 03 #Idapuesta# | F12: of:=[.D16] -> BET365 | G12: of:=CONCATENATE([.C16];[.C17];[.C18])& " "&[.C13] -> mercado1 vs mercado3 h.#HORA# | I12: of:=[.E15] -> fecha: A#/#MES# | J12: of:=SUM([.F16:.F19]) ->  | N12: BET365 | U12: of:=[.T7] -> #Idapuesta# | V12: Apuesta Normal | W12: of:="FECHA: " & [.U8] &"/" & [.U9] -> FECHA: A#/S# | X12: of:=CONCATENATE([.U13];" ";[.U14];" ";[.U15]) -> 0  vs  EN CONTRA | Y12: of:=CONCATENATE("Importe Jugado:";ROUND(SUM([.X13:.X16]);2)) -> Importe Jugado:1 | AA12: of:=CONCATENATE("Id: 03 ";[.U12]) -> Id: 03 #Idapuesta#
A13: fecha: dia | B13: of:=[$TyC.$D$2] -> #DIA# | C13: of:="h."&[.B15] -> h.#HORA# | E13: Modelo Para apuesta NORMAL | P13: PREMIO | R13: 0.98 | S13: comision | U13: of:=[.W13] -> 0 | V13: of:=[.N12] -> BET365 | W13: of:=[.O12] -> 0 | X13: of:=IF([.P12]=0;1;[.P12]) -> 1 | Y13: of:=[.Z13]/[.X13] -> 0 | Z13: of:=[.P14] -> 0 | AA13: of:=MIN([.Z13:.Z14])-[.X13]-[.X14] -> -1
A14: fecha: mes | B14: of:=[$TyC.$B$2] -> #MES# | D14: Casa | E14: Mercado | F14: Cantidad | G14: Cuota | H14: Premio | I14: Beneficio | J14: Resultado | N14: cuota | P14: of:=[.O14]*[.P12] -> 0 | R14: of:=[.R12]*[.R13] -> 0 | S14: beneficio real | U14: vs | V14: BETFAIR | W14: EN CONTRA | X14: of:=[.Q12] -> 0 | Y14: of:=[.Z14]/[.X14] ->  | Z14: of:=[.Q12]+[.R14] -> 0
A15: HORA: | B15: of:=[$TyC.$F$2] -> #HORA# | C15: of:=[.B12] -> #Idapuesta# | D15: Apuesta Normal | E15: of:="fecha: "& RIGHT("0"&[.B13];2) & "/" &[.B14] -> fecha: A#/#MES# | F15: of:=CONCATENATE([.C16];" ";[.C17];" ";[.C18]) -> mercado1  vs  mercado3 | G15: of:=CONCATENATE("Importe Jugado:";ROUND(SUM([.F16:.F19]);2)) ->  | I15: of:=CONCATENATE("Id: 03 ";[.C15]) -> Id: 03 #Idapuesta# | P15: OTRA CASA | Q15: BEFTAIR | U15: of:=[.W14] -> EN CONTRA | V15: coe: | W15: of:=[.AA13]/[.X13] -> -1
C16: of:=[.E16] -> mercado1 | D16: BET365 | E16: of:=[.H1] -> mercado1 | F16: of:=[.C6] -> 25 | G16: of:=[.D6] -> 10.8748 | H16: of:=[.G16]*[.F16] -> 271.87 | I16: of:=[.H16]-SUM([.F16:.F19]) ->  | K16: Opcion 1
C17: vs | D17: of:=[.I2] -> 0 | E17: of:=[.I1] -> mercado2 | F17: of:=[.H17]/[.G17] ->  | G17: of:=[.I6] -> 0 | H17: of:=[.H16] -> 271.87 | K17: Casa 2
C18: of:=[.E18] -> mercado3 | D18: of:=[.J2] -> 0 | E18: of:=[.J1] -> mercado3 | F18: of:=[.H18]/[.G18] ->  | G18: of:=[.J6] -> 0 | H18: of:=[.H16] -> 271.87 | K18: Casa 3
D19: coe: | E19: of:=[.I16]/[.F16] -> 
A22: ID APUESTA: | B22: of:=[$TyC.$I$2] -> #Idapuesta# | D22: of:=[.I26] ->  | E22: of:=[.I25] -> Id: 03 #Idapuesta# | F22: of:=[.D26] -> BET365 | G22: of:=CONCATENATE([.C26];[.C27];[.C28])& " "&[.C23] -> mercado2 vs mercado3 h.#HORA# | I22: of:=[.E25] -> fecha: A#/#MES# | J22: of:=SUM([.F26:.F29]) -> 
A23: fecha: dia | B23: of:=[$TyC.$D$2] -> #DIA# | C23: of:="h."&[.B25] -> h.#HORA# | E23: Modelo Para apuesta NORMAL
A24: fecha: mes | B24: of:=[$TyC.$B$2] -> #MES# | D24: Casa | E24: Mercado | F24: Cantidad | G24: Cuota | H24: Premio | I24: Beneficio | J24: Resultado
A25: HORA: | B25: of:=[$TyC.$F$2] -> #HORA# | C25: of:=[.B22] -> #Idapuesta# | D25: Apuesta Normal | E25: of:="fecha: "& RIGHT("0"&[.B23];2) & "/" &[.B24] -> fecha: A#/#MES# | F25: of:=CONCATENATE([.C26];" ";[.C27];" ";[.C28]) -> mercado2  vs  mercado3 | G25: of:=CONCATENATE("Importe Jugado:";ROUND(SUM([.F26:.F29]);2)) ->  | I25: of:=CONCATENATE("Id: 03 ";[.C25]) -> Id: 03 #Idapuesta#
C26: of:=[.E26] -> mercado2 | D26: BET365 | E26: of:=[.I1] -> mercado2 | F26: of:=[.F16] -> 25 | G26: of:=[.D7] -> 14.5 | H26: of:=[.G26]*[.F26] -> 362.5 | I26: of:=[.H26]-SUM([.F26:.F29]) ->  | K26: Opcion 2
C27: vs | D27: of:=[.H2] -> 0 | E27: of:=[.H1] -> mercado1 | F27: of:=[.H27]/[.G27] ->  | G27: of:=[.H7] -> 0 | H27: of:=[.H26] -> 362.5 | K27: Casa 1
C28: of:=[.E28] -> mercado3 | D28: of:=[.J2] -> 0 | E28: of:=[.J1] -> mercado3 | F28: of:=[.H28]/[.G28] ->  | G28: of:=[.J7] -> 0 | H28: of:=[.H26] -> 362.5 | K28: Casa 3
D29: coe: | E29: of:=[.I26]/[.F26] -> 
A33: ID APUESTA: | B33: of:=[$TyC.$I$2] -> #Idapuesta# | D33: of:=[.I37] ->  | E33: of:=[.I36] -> Id: 03 #Idapuesta# | F33: of:=[.D37] -> bet365 | G33: of:=CONCATENATE([.C37];[.C38];[.C39])& " "&[.C34] -> mercado3 vs mercado2 h.#HORA# | I33: of:=[.E36] -> fecha: A#/#MES# | J33: of:=SUM([.F37:.F40]) -> 
A34: fecha: dia | B34: of:=[$TyC.$D$2] -> #DIA# | C34: of:="h."&[.B36] -> h.#HORA# | E34: Modelo Para apuesta NORMAL
A35: fecha: mes | B35: of:=[$TyC.$B$2] -> #MES# | D35: Casa | E35: Mercado | F35: Cantidad | G35: Cuota | H35: Premio | I35: Beneficio | J35: Resultado
A36: HORA: | B36: of:=[$TyC.$F$2] -> #HORA# | C36: of:=[.B33] -> #Idapuesta# | D36: Apuesta Normal | E36: of:="fecha: "& RIGHT("0"&[.B34];2) & "/" &[.B35] -> fecha: A#/#MES# | F36: of:=CONCATENATE([.C37];" ";[.C38];" ";[.C39]) -> mercado3  vs  mercado2 | G36: of:=CONCATENATE("Importe Jugado:";ROUND(SUM([.F37:.F40]);2)) ->  | I36: of:=CONCATENATE("Id: 03 ";[.C36]) -> Id: 03 #Idapuesta#
C37: of:=[.E37] -> mercado3 | D37: bet365 | E37: of:=[.J1] -> mercado3 | F37: of:=[.F16] -> 25 | G37: of:=[.D8] -> 15.5 | H37: of:=[.G37]*[.F37] -> 387.5 | I37: of:=[.H37]-SUM([.F37:.F40]) ->  | K37: Opcion 2
C38: vs | D38: of:=[.H2] -> 0 | E38: of:=[.H1] -> mercado1 | F38: of:=[.H38]/[.G38] ->  | G38: of:=[.H8] -> 0 | H38: of:=[.H37] -> 387.5 | K38: Casa 1
C39: of:=[.E39] -> mercado2 | D39: of:=[.I2] -> 0 | E39: of:=[.I1] -> mercado2 | F39: of:=[.H39]/[.G39] ->  | G39: of:=[.I8] -> 0 | H39: of:=[.H37] -> 387.5 | K39: Casa 2
D40: coe: | E40: of:=[.I37]/[.F37] -> 

Sheet: COMBINADA WINAMAX
H3: Encuentro | K3: Cuota | L3: Resultado
H5: JAPON VS COSTA RICA | K5: 4.2 | L5: EMPATE
H7: BELGICA VS MARRUECO | K7: 1.84 | L7: BELGICA
J9: TOTAL CUOTA | K9: of:=[.K7]*[.K5] -> 7.728
A10: GANAR UNA APUESTA COMBINADA
C16: COMBINADA
E17: APUESTA | F17: CUOTA | G17: PREMIO | I17: BENEFICIO | K17: TOTAL
D18: EMPATE + BELGICA | E18: 5 | F18: of:=[.K9] -> 7.728 | G18: of:=[.F18]*[.E18] -> 38.64 | H18: → SI GANO | I18: of:=[.G18] -> 38.64 | K18: of:=[.I18]+[.I19] -> 52.64
H19: FREEBET: | I19: of:=+0.7*[.H20] -> 14
H20: 20 | I20: ,
C21: CONTRA 1 | E21: APUESTAS | F21: CUOTAS | J21: gano contra 1 | L21: BENEFICIO | M21: GASTO | N21: PREMIO
C22: ALDMIRAL | D22: JAPON | E22: of:=[.G22]/[.F22] -> 17.0769230769231 | F22: 1.56 | G22: of:=[.I19]+[.I18]-[.J22] -> 26.64 | I22: regularizacion: | J22: 26 | L22: of:=[.G22] -> 26.64 | M22: of:=[.E22]+[.E23]+[.E18] -> 25.6289230769231 | N22: of:=[.L22]-[.M22] -> 1.01107692307692
C23: WINAMAX | D23: COSTARICA | E23: of:=[.G23]/[.F23] -> 3.552 | F23: 7.5 | G23: of:=[.G22] -> 26.64 | M23: (CLA+CONTRA1)
J26: gano contra2 | L26: BENEFICIO | M26: GASTO | N26: PREMIO
A27: (SOLO HACER CUANDO | C27: CONTRA 2 | L27: of:=[.I19]+[.I18] -> 52.64 | M27: of:=SUM([.E28:.E31]) -> 51.6570920910076 | N27: of:=[.L27]-[.M27] -> 0.982907908992416
A28: SE PIERDE CONTRA1 ) | D28: EMPATE | E28: of:=[.G28]/[.F28] -> 14.8281690140845 | F28: 3.55 | G28: of:=[.L27] -> 52.64 | M28: (CLA+CONTRA1+CONTRA2)
D29: MARRUECO | E29: of:=[.G29]/[.F29] -> 11.2 | F29: 4.7 | G29: of:=[.G28] -> 52.64
D30: ANTIGUA (CRONTRA1) | E30: of:=[.E23]+[.E22] -> 20.6289230769231
D31: ANTIGUA (COMBI) | E31: of:=[.E18] -> 5
J32: gano combinada | L32: BENEFICIO | M32: GASTO | N32: PREMIO
L33: of:=[.I18]+[.I19] -> 52.64 | M33: of:=SUM([.E28:.E31]) -> 51.6570920910076 | N33: of:=[.L33]-[.M33] -> 0.982907908992416